393,,"HRS-9: Infection within 180 Days of Cardiac Implantable Electronic Device (CIED) Implantation, Replacement, or Revision ",Patient - Process,N/A,"This measure requires the reporting of only one data completeness and performance rate. There are two reporting criteria for this measure:
1) Patients, regardless of age, with a new CIED
OR
2) Patients, regardless of age, with a replaced or revised CIED
",Y,N,1,N/A,Registry
394,,Immunizations for Adolescents ,Patient - Process,N/A,"This measure requires the reporting of four performance rates. The third performance rate outlined below should be utilized for an overall data completeness and performance rate for this measure.
This measure will be calculated with 4 performance rates:
1)  Patients who had one dose of meningococcal vaccine on or between the patient’s 11th and 13th birthdays
2)  Patients who had one tetanus, diphtheria toxoids and acellular pertussis vaccine (Tdap) or one tetanus, diphtheria toxoids vaccine (Td) on or between the patient’s 10th and 13th birthdays                                         
3) Patients who had at least three HPV vaccines with different dates of service on or between the patient's 9th and 13th birthdays                        4) All patients who are compliant for both Meningococcal AND Td/Tdap AND HPV during the specified timeframes.",N,N,4,4th Performance Rate,Registry
395,,Lung Cancer Reporting (Biopsy/Cytology Specimens) ,Procedure,N/A,"Claims: Only one QDC per date of service for a patient is required. 
",N,N,1,N/A,"Claims, Registry"
396,,Lung Cancer Reporting (Resection Specimens) ,Procedure,N/A,"Claims: Only one QDC per date of service for a patient is required. 
",N,N,1,N/A,"Claims, Registry"
397,,Melanoma Reporting ,Procedure,N/A,"Claims: Only one QDC per date of service for a patient is required. 
",N,N,1,N/A,"Claims, Registry"
398,,Optimal Asthma Control ,Patient - Process,N/A,"The measure has multiple denominator options. This measure requires the reporting of seven  performance rates. The first performance rate outlined below should be utilized for an overall data completeness and performance rate for this measure.

This measure should be calculated with 7 performance rates:
1. Overall Percentage for patients (aged 5-50 years) with well-controlled asthma, without elevated risk of exacerbation. 
2. Percentage of pediatric patients (aged 5-17 years) with well-controlled asthma, without elevated risk of exacerbation. 
3. Percentage of adult patients (aged 18-50 years) with well-controlled asthma, without elevated risk of exacerbation. 
4. Asthma well-controlled (take the most recent ACT) for patients 5 to 17 with Asthma 
5. Asthma well-controlled (take the most recent ACT) for patients 18 to 50 with Asthma 
6. Patient not at elevated risk of exacerbation for patients 5 to 17 with Asthma 
7. Patient not at elevated risk of exacerbation for patients 18 to 50 with Asthma ",N,N,7,1st Performance Rate,Registry
400,,One-Time Screening for Hepatitis C Virus (HCV) for Patients at Risk,Patient - Process,N/A, ,N,Y,1,N/A,Registry
401,,Hepatitis C: Screening for Hepatocellular Carcinoma (HCC) in Patients with Cirrhosis,Patient - Process,N/A,,N,N,1,N/A,Registry
402,,Tobacco Use and Help with Quitting Among Adolescents ,Patient - Process,N/A,,N,N,1,N/A,Registry
403,,Adult Kidney Disease: Referral to Hospice,Patient - Process,N/A,,N,N,1,N/A,Registry
404,,Anesthesiology Smoking Abstinence,Procedure (Regardless of TIN/NPI),N/A,,N,N,1,N/A,Registry
405,,Appropriate Follow-up Imaging for Incidental Abdominal Lesions,Procedure,N/A,,Y,N,1,N/A,"Claims, Registry"
406,,Appropriate Follow-up Imaging for Incidental Thyroid Nodules in Patients,Procedure,N/A,,Y,N,1,N/A,"Claims, Registry"
407,,Appropriate Treatment of MSSA Bacteremia,Episode (Regardless of TIN/NPI),N/A,"Claims: Utilize Part B Claims. Correlate eligible cases with inpatient ""hidden"" codes at the bene-level regardless of TIN/NPI to determine the length of hospital stay (episode). ""Hidden"" inpatient code line items that are denied or include modifier 80, 81 or 82 should be included in this analysis.  
•REFER TO THE ""HIDDEN CODES"" TAB OF THE SINGLE SOURCE FOR A COMPLETE LISTING OF CPT I INPATIENT ""HIDDEN"" CODES                                                                           • Inpatient ""hidden"" CPT I codes are counted once per hospital stay 
• Multiple ICD10 codes on the same claim are counted once
• Maximum one episode per claim (even if there is a break in DOS for inpatient ""hidden"" CPT I codes on that claim)
• Count any inpatient ""hidden"" CPT I in a string of consecutive DOS at bene level for all TIN/NPI as one episode 
• Look across claims to determine the episode based on ""consecutive dates of service,"" use the earliest DOS for an inpatient ""hidden"" CPT I code and the latest DOS for an inpatient ""hidden"" CPT I code on each claim to identify claims with consecutive DOS.
• Most favorable instance of reporting is used in performance rate",N,N,1,N/A,"Claims, Registry"
408,,Opioid Therapy Follow-up Evaluation,Patient - Process,N/A,,N,N,1,N/A,Registry
409,,Clinical Outcome Post Endovascular Stroke Treatment,Procedure,N/A,,N,N,1,N/A,Registry
410,,Psoriasis: Clinical Response to Oral Systemic or Biologic Medications,Patient - Process,N/A,"Encounter codes with Telehealth modifiers GQ, GT would not  be considered denominator eligible encounters.",N,N,1,N/A,"Claims, Registry"
411,,Depression Remission at Six Months,Patient - Process,N/A,,N,N,1,N/A,Registry
412,,Documentation of Signed Opioid Treatment Agreement,Patient - Process,N/A,,N,N,1,N/A,Registry
413,,Door to Puncture Time for Endovascular Stroke Treatment,Procedure,N/A,,N,N,1,N/A,Registry
414,,Evaluation or Interview for Risk of Opioid Misuse,Patient - Process,N/A,,N,N,1,N/A,Registry
415,,Emergency Medicine: Emergency Department Utilization of CT for Minor Blunt Head Trauma for Patients Aged 18 Years and Older,Visit,N/A,"Claims: The patient should have CPT 70450 (regardless of TIN/NPI) on the same date of service as the denominator eligible encounter in order to be included in the denominator. 
",N,N,1,N/A,"Claims, Registry"
416,,Emergency Medicine: Emergency Department Utilization of CT for Minor Blunt Head Trauma for Patients Aged 2 through 17 Years ,Visit,N/A,"Claims: The patient should have CPT 70450 (regardless of TIN/NPI) on the same date of service as the denominator eligible encounter in order to be included in the denominator. 
",Y,N,1,N/A,"Claims, Registry"
417,,Rate of Open Repair of Abdominal Aortic Aneurysms (AAA) Where Patients Are Discharged Alive,Procedure,N/A,,N,N,1,N/A,Registry
418,,Osteoporosis Management in Women Who Had a Fracture,Episode (TIN/NPI/Bene-level),N/A,"Claims: Count each unique diagnosis as an episode for an TIN/NPI/Bene unless multiple diagnoses appear on the same claim.      
• Multiple qualifying ICD10 or CPT I procedures on a single claim are counted once. (A single claim can be counted a maximum of once for an episode per TIN/NPI/Bene combo regardless of the number of qualifying DXs or procedures that exist.)
• Multiple claims with any intersecting diagnosis will be counted once. Intersecting claims with diagnosis codes will be counted once. All claims that share diagnosis codes are combined into one episode, given they have the same TIN/NPI/Bene                                                                                                                                                                               • If the TIN/NPI/Bene combo has multiple claims containing *different* qualifying DX codes that have not been submitted during the performance period, then these claims may each count as additional episodes.
• Use the most favorable instance of reporting for performance rates if multiple conflicting QDCs exist on a qualifying episode.
• The QDC must exist on the claim with the qualifying denom episode (overarching rule for all measures).
",N,N,1,N/A,"Claims, Registry"
419,,Overuse Of Neuroimaging For Patients With Primary Headache And A Normal Neurological Examination ,Visit,N/A,"Encounter codes with Telehealth modifiers GQ, GT would not  be considered denominator eligible encounters.
",N,N,1,N/A,"Claims, Registry"
420,,Varicose Vein Treatment with Saphenous Ablation: Outcome Survey,Procedure,N/A,,N,N,1,N/A,Registry
421,,Appropriate Assessment of Retrievable Inferior Vena Cava Filters for Removal,Procedure,N/A,,N,N,1,N/A,Registry
422,,Performing Cystoscopy at the Time of Hysterectomy for Pelvic Organ Prolapse to Detect Lower Urinary Tract Injury,Procedure,N/A,,N,N,1,N/A,"Claims, Registry"
423,,Perioperative Anti-platelet Therapy for Patients undergoing Carotid Endarterectomy,Procedure,N/A,,N,N,1,N/A,"Claims, Registry"
424,,Perioperative Temperature Management,Procedure,N/A,,N,N,1,N/A,Registry
425,,Photodocumentation of Cecal Intubation,Procedure,N/A,"Denominator eligible CPT codes submitted with a modifier 73 and 74 should be excluded from the denominator for claims or excluded by the registry.  If QDCs are submitted on the same claim for multiple measures, exclude only the line item with the modifier.
",N,N,1,N/A,"Claims, Registry"
426,,Post-Anesthetic Transfer of Care Measure: Procedure Room to a Post Anesthesia Care Unit (PACU),Procedure,N/A,,N,N,1,N/A,Registry
427,,Post-Anesthetic Transfer of Care: Use of Checklist or Protocol for Direct Transfer of Care from Procedure Room to Intensive Care Unit (ICU),Procedure,N/A,,N,N,1,N/A,Registry
428,,Pelvic Organ Prolapse: Preoperative Assessment of Occult Stress Urinary Incontinence,Procedure,N/A,,N,N,1,N/A,Registry
429,,Pelvic Organ Prolapse: Preoperative Screening for Uterine Malignancy,Procedure,N/A,,N,N,1,N/A,"Claims, Registry"
430,,Prevention of Post-Operative Nausea and Vomiting (PONV) – Combination Therapy,Procedure,N/A,,N,N,1,N/A,Registry
431,,Preventive Care and Screening: Unhealthy Alcohol Use: Screening & Brief Counseling,Patient - Process,N/A,,N,Y,1,N/A,Registry
432,,Proportion of Patients Sustaining a Bladder Injury at the Time of any Pelvic Organ Prolapse Repair,Procedure,N/A,,Y,N,1,N/A,Registry
433,,Proportion of Patients Sustaining a Major Viscus Injury at the time of any Pelvic Organ Prolapse Repair,Procedure,N/A,,Y,N,1,N/A,Registry
434,,Proportion of Patients Sustaining a Ureter Injury at the Time of any Pelvic Organ Prolapse Repair,Procedure,N/A,,Y,N,1,N/A,Registry
435,,Quality of Life Assessment For Patients With Primary Headache Disorders ,Patient - Process,N/A,"Claims: Two denominator eligible visits for the same TIN/NPI with two different dates of service are required to be denominator eligible. The QDC needs to be reported on the 2nd visit (based on date of service) or a subsequent visit if more than two visits are found within the reporting period. A QDC submitted on the first visit (based on date of service) in the reporting period will not be counted. The most advantageous QDC should be utilized if multiple QDCs are submitted on any visit but the first visit within the reporting period.                                                                          For the numerator, quality of life assessments with MIDAS must be separated by at least 90 days (4 weeks for any other tool).  
Encounter codes with Telehealth modifiers GQ, GT would not  be considered denominator eligible encounters.
",N,N,1,N/A,"Claims, Registry"
436,,Radiation Consideration for Adult CT: Utilization of Dose Lowering Techniques,Procedure,N/A,,N,Y,1,N/A,"Claims, Registry"
437,,Rate of Surgical Conversion from Lower Extremity Endovascular Revascularization Procedure,Procedure,N/A,"Include only patients undergoing an endovascular lower extremity revascularization procedure through December 29 of the reporting period. This will allow the evaluation of at least 48 hours of the procedure within the reporting year.
",Y,N,1,N/A,"Claims, Registry"
438,,Statin Therapy for the Prevention and Treatment of Cardiovascular Disease,Patient - Process,N/A,"The measure has multiple reporting criteria. This measure requires the reporting of only one reporting and performance rate.  All considered at high risk of cardiovascular events—who were prescribed or were on statin therapy during the measurement period: 
1. Adults aged ≥ 21 years who were previously diagnosed with or currently have an active diagnosis of clinical atherosclerotic cardiovascular disease (ASCVD); OR 
2. Adults aged ≥21 years with a fasting or direct low-density lipoprotein cholesterol (LDL-C) level ≥ 190 mg/dL; OR 
3. Adults aged 40-75 years with a diagnosis of diabetes with a fasting or direct LDL-C level of 70-189 mg/dL 
",N,N,1,N/A,Registry
439,,Age Appropriate Screening Colonoscopy,Procedure,N/A,,Y,N,1,N/A,Registry
440,,Basal Cell Carcinoma (BCC)/Squamous Cell Carcinoma: Biopsy Reporting Time – Pathologist to Clinician ,Procedure,N/A,,N,N,1,N/A,Registry
441,,Ischemic Vascular Disease (IVD) All or None Outcome Measure (Optimal Control),Patient - Intermediate,N/A,,N,N,1,N/A,Registry
442,,Persistence of Beta-Blocker Treatment After a Heart Attack,Patient - Process,N/A, ,N,N,1,N/A,Registry
443,,Non-Recommended Cervical Cancer Screening in Adolescent Females,Patient - Process,N/A,,Y,N,1,N/A,Registry
444,,Medication Management for People with Asthma,Patient - Process,N/A,,N,N,1,N/A,Registry
445,,Risk-Adjusted Operative Mortality for Coronary Artery Bypass Graft (CABG),Patient - Process,N/A, ,Y,N,1,N/A,Registry
446,,Operative Mortality Stratified by the Five STS-EACTS Mortality Categories ,Procedure,N/A,,Y,N,1,N/A,Registry
447,,Chlamydia Screening and Follow Up ,Patient - Process,N/A,,N,N,1,N/A,Registry
448,,Appropriate Workup Prior to Endometrial Ablation ,Procedure,N/A,,N,N,1,N/A,Registry
449,,HER2 Negative or Undocumented Breast Cancer Patients Spared Treatment with HER2-Targeted Therapies,Patient - Process,N/A,,N,N,1,N/A,Registry
450,,Trastuzumab Received By Patients With AJCC Stage I (T1c) – III And HER2 Positive Breast Cancer Receiving Adjuvant Chemotherapy ,Patient - Process,N/A,,N,N,1,N/A,Registry
451,,KRAS Gene Mutation Testing Performed for Patients with Metastatic Colorectal Cancer who receive Anti-epidermal Growth Factor Receptor (EGFR) Monoclonal Antibody Therapy,Patient - Process,N/A,,N,N,1,N/A,Registry
452,,Patients with Metastatic Colorectal Cancer and KRAS Gene Mutation Spared Treatment with Anti-epidermal Growth Factor Receptor (EGFR) Monoclonal Antibodies ,Patient - Process,N/A,,N,N,1,N/A,Registry
453,,Proportion Receiving Chemotherapy in the Last 14 Days of Life,Patient - Process,N/A,,Y,N,1,N/A,Registry
454,,Proportion of Patients who Died from Cancer with more than One Emergency Department Visit in the Last 30 Days of Life,Patient - Process,N/A,,Y,N,1,N/A,Registry
455,,Proportion Admitted to the Intensive Care Unit (ICU) in the Last 30 Days of Life,Patient - Process,N/A,,Y,N,1,N/A,Registry
456,,Proportion Not Admitted To Hospice,Patient - Process,N/A,,Y,N,1,N/A,Registry
457,,Proportion Admitted to Hospice for less than 3 days,Patient - Process,N/A,,Y,N,1,N/A,Registry
